<!ELEMENT perks (perk+)>
<!ELEMENT perk (nome?, descrizione?)>
<!ELEMENT nome (#PCDATA)>
<!ELEMENT descrizione (#PCDATA)>

<!ATTLIST perk tipo CDATA #REQUIRED>
